{
  "schema_version": "1.1",
  "profile_id": "envp_preprod_supervised_high",
  "environment": "preprod",
  "delivery_stage": "preprod",
  "risk_level": "high",
  "autonomy_mode": "supervised_autonomous",
  "allowed_capabilities": [
    "code_edit",
    "test_create",
    "test_run",
    "config_edit_nonprod"
  ],
  "blocked_capabilities": [
    "prod_deploy",
    "privileged_iam_changes"
  ],
  "approval_level": "high",
  "integrity": {
    "signed": false
  }
}
